{
  "omf_version": "0.1",
  "subject": { "id": "u_7f3a", "display_name": "Alex", "locale": "en-US", "timezone": "America/Chicago" },
  "exported_at": "2026-10-17T15:00:00Z",
  "exported_by": { "agent": "example-agent", "agent_version": "0.1.0" },
  "facts": [
    {
      "id": "f_001",
      "category": "preference",
      "key": "travel.seat_preference",
      "statement": "Prefers aisle seats on flights longer than 2 hours.",
      "value": { "seat": "aisle", "min_flight_hours": 2 },
      "source": { "type": "user_stated", "channel": "sms", "reference": "evt_1029" },
      "confidence": 1.0,
      "scope": "travel.preferences",
      "sensitivity": "low",
      "created_at": "2026-09-02T14:11:00Z",
      "expires_at": null
    },
    {
      "id": "f_002",
      "category": "habit",
      "key": "travel.hotel_chain",
      "statement": "Usually books the same hotel chain when traveling for work.",
      "source": { "type": "inferred", "reference": "evt_1311" },
      "confidence": 0.7,
      "scope": "travel.preferences",
      "created_at": "2026-09-20T09:00:00Z",
      "expires_at": "2027-09-20T09:00:00Z"
    },
    {
      "id": "f_003",
      "category": "constraint",
      "statement": "Never book flights departing before 7 a.m.",
      "source": { "type": "user_stated", "channel": "voice", "reference": "evt_1402" },
      "confidence": 1.0,
      "scope": "travel.preferences",
      "created_at": "2026-10-01T18:30:00Z"
    }
  ],
  "people": [
    {
      "id": "p_01",
      "name": "Jordan",
      "relationship": "spouse",
      "shared_scopes": ["calendar:read", "travel.preferences"],
      "notify_on_out_of_scope": true
    },
    {
      "id": "p_02",
      "name": "Sam",
      "relationship": "colleague",
      "contact": { "agent_card_url": "https://agents.example.com/sam/.well-known/agent-card.json" },
      "shared_scopes": ["calendar.work:read"],
      "notify_on_out_of_scope": true
    }
  ],
  "grants": [
    {
      "service": "google_calendar",
      "scopes": ["calendar.events"],
      "granted_at": "2026-09-01T12:00:00Z",
      "revoked_at": null,
      "credential_ref": "vault://cred/9c1e"
    }
  ]
}
